{
  "schema_version": "basisReSourceSvgInventory/v2",
  "module_id": "<module_id>",
  "source_root": "source-materials/basis-seminar/powerpoint-svg/<module_id>/SVG/",
  "input_kind": "powerpoint_slide_svg",
  "text_root": "source-materials/basis-seminar/powerpoint-svg/<module_id>/Text/",
  "text_mapping_file": "analysis/inventories/<module_id>_svg-text-map.json",
  "text_mapping_status": "mapped",
  "narration_root": null,
  "narration_status": "mapped",
  "slides": [
    {
      "source_slide_number": 1,
      "source_slide_key": "slide_001",
      "source_svg": "source-materials/basis-seminar/powerpoint-svg/<module_id>/SVG/slide_001.svg",
      "sha256": "0000000000000000000000000000000000000000000000000000000000000000",
      "view_box": "0 0 1920 1080",
      "width": null,
      "height": null,
      "spoken_text_source": "analysis/source-text/<module_id>/extracted/slide_001.md",
      "text_mapping_ref": "analysis/inventories/<module_id>_svg-text-map.json#slide_001",
      "spoken_text": "Wortgetreu extrahierter Sprechertext.",
      "technical_status": "ready",
      "visible_content_summary": "",
      "visible_text": [],
      "features": {
        "group_count": 0,
        "id_count": 0,
        "has_external_references": false,
        "has_embedded_images": false,
        "has_foreign_object": false,
        "has_script": false
      },
      "references": [],
      "sequence_role": "standalone",
      "state_delta": {
        "compared_to": null,
        "added": [],
        "removed": [],
        "changed": [],
        "interpretation": ""
      },
      "candidate_sequence_group": null,
      "transformation_notes": [],
      "qa": {
        "issues": [],
        "warnings": [],
        "open_questions": []
      }
    }
  ],
  "qa": {
    "issues": [],
    "warnings": [],
    "open_questions": []
  }
}
